{
  "$schema": "../../../../schemas/harness.config.schema.json",
  "version": "self",
  "project": {
    "name": "consumer-non-selfhost-with-readme",
    "agent_suffix": "tst"
  },
  "managed": {
    "files": []
  },
  "composed": {
    "files": []
  },
  "seeded": {
    "files": []
  },
  "excluded": [],
  "scaffolds": []
}
