{
  "$schema": "../../../../schemas/harness.config.schema.json",
  "version": "self",
  "project": {
    "name": "consumer-missing-script",
    "agent_suffix": "tst"
  },
  "managed": {
    "files": []
  },
  "composed": {
    "files": []
  },
  "seeded": {
    "files": []
  },
  "excluded": [],
  "scaffolds": [
    "migrations"
  ]
}
